{
  "$schema": "https://json-schema.org/draft/2020-12/schema",
  "$id": "https://curve.example.invalid/candidates/manual-planning-v3/manual-plan-profile-v3.schema.json",
  "title": "Immutable zero-automation manual planning profile",
  "type": "object",
  "additionalProperties": false,
  "required": [
    "schema_version",
    "id",
    "version",
    "profile_code",
    "initiative_mode",
    "model_policy_ref",
    "tool_policy_ref",
    "budget_policy_ref",
    "gates",
    "human_native_tool_authority",
    "quality_obligations",
    "automatic_execution"
  ],
  "properties": {
    "schema_version": {
      "const": "curve.manual-plan-profile/v3-candidate"
    },
    "id": {
      "const": "20000000-0000-4000-8000-000000000301"
    },
    "version": {
      "const": 2
    },
    "profile_code": {
      "const": "SDLC_MANUAL"
    },
    "initiative_mode": {
      "const": "STANDALONE"
    },
    "model_policy_ref": {
      "allOf": [
        {
          "allOf": [
            {
              "$ref": "https://curve.example.invalid/candidates/manual-planning-v3/common-v3.schema.json#/$defs/DigestVersionRef"
            }
          ],
          "const": {
            "entity_id": "20000000-0000-4000-8000-000000000202",
            "digest": "sha256:37116f895439afc21bb718e85763bf6e7577e7042d46b1e01de8a8bdbccaeb26"
          }
        }
      ],
      "const": {
        "entity_id": "20000000-0000-4000-8000-000000000202",
        "digest": "sha256:37116f895439afc21bb718e85763bf6e7577e7042d46b1e01de8a8bdbccaeb26"
      }
    },
    "tool_policy_ref": {
      "allOf": [
        {
          "allOf": [
            {
              "$ref": "https://curve.example.invalid/candidates/manual-planning-v3/common-v3.schema.json#/$defs/DigestVersionRef"
            }
          ],
          "const": {
            "entity_id": "20000000-0000-4000-8000-000000000203",
            "digest": "sha256:fbbcc3eaece56294f76d846b8a83654cf07951641b020c9b557844b5b6027b61"
          }
        }
      ],
      "const": {
        "entity_id": "20000000-0000-4000-8000-000000000203",
        "digest": "sha256:fbbcc3eaece56294f76d846b8a83654cf07951641b020c9b557844b5b6027b61"
      }
    },
    "budget_policy_ref": {
      "allOf": [
        {
          "allOf": [
            {
              "$ref": "https://curve.example.invalid/candidates/manual-planning-v3/common-v3.schema.json#/$defs/DigestVersionRef"
            }
          ],
          "const": {
            "entity_id": "20000000-0000-4000-8000-000000000204",
            "digest": "sha256:25bd9129a8d8cca13a81aff51c6f9d16d0bdae18689f968eb82783f95d51bbc8"
          }
        }
      ],
      "const": {
        "entity_id": "20000000-0000-4000-8000-000000000204",
        "digest": "sha256:25bd9129a8d8cca13a81aff51c6f9d16d0bdae18689f968eb82783f95d51bbc8"
      }
    },
    "gates": {
      "const": [
        "PRD_APPROVAL",
        "PLAN_APPROVAL"
      ]
    },
    "human_native_tool_authority": {
      "const": "INDEPENDENT_CURRENT_AUTHORIZATION"
    },
    "quality_obligations": {
      "const": "UNCHANGED"
    },
    "automatic_execution": {
      "const": "DENIED"
    }
  }
}
