{
  "schema_version": "curve.manual-plan-profile/v3-candidate",
  "id": "20000000-0000-4000-8000-000000000301",
  "version": 2,
  "profile_code": "SDLC_MANUAL",
  "initiative_mode": "STANDALONE",
  "model_policy_ref": {
    "entity_id": "20000000-0000-4000-8000-000000000202",
    "digest": "sha256:37116f895439afc21bb718e85763bf6e7577e7042d46b1e01de8a8bdbccaeb26"
  },
  "tool_policy_ref": {
    "entity_id": "20000000-0000-4000-8000-000000000203",
    "digest": "sha256:fbbcc3eaece56294f76d846b8a83654cf07951641b020c9b557844b5b6027b61"
  },
  "budget_policy_ref": {
    "entity_id": "20000000-0000-4000-8000-000000000204",
    "digest": "sha256:25bd9129a8d8cca13a81aff51c6f9d16d0bdae18689f968eb82783f95d51bbc8"
  },
  "gates": [
    "PRD_APPROVAL",
    "PLAN_APPROVAL"
  ],
  "human_native_tool_authority": "INDEPENDENT_CURRENT_AUTHORIZATION",
  "quality_obligations": "UNCHANGED",
  "automatic_execution": "DENIED"
}
